scenario,description,initial_float,carefi_capture_pct,acquisition_price,medical_cpi_fv,pool_medusdi,pool_usdc,monthly_volume,fee_bps,carefi_lp_share,organic_usdi_sliced,med_slice_pct,reference_option_value,revenue_multiple,pre_money,investor_check
Initial Float Capture,"CareFi acquires the initial independent USDiMED float at a discount to medical-CPI fair value before a broad secondary market forms.",1000000,1.00,1.00,1.05,0,0,0,30,1.00,0,0.08,250000,6,5000000,500000
Anchor LP Market Launch,"CareFi allocates part of its discounted float plus USDC to seed the first external MEDUSDi / USDC reference market.",1000000,1.00,1.00,1.05,300000,315000,3000000,30,0.85,0,0.08,750000,8,5000000,500000
Specialist Basis Flow,"Specialist traders begin trading the basis between MEDUSDi spot, medical-CPI fair value, and healthcare-inflation expectations.",1500000,0.85,1.00,1.06,500000,530000,15000000,30,0.70,2500000,0.08,1500000,8,6000000,750000
Organic Supply Expansion,"Additional MEDUSDi supply emerges as USDi holders create medical slices; the market deepens while CareFi remains the anchor LP/operator.",2500000,0.65,1.01,1.07,750000,802500,50000000,30,0.50,10000000,0.08,3000000,10,8000000,1000000
Infrastructure Scale Case,"The MEDUSDi / USDC pool becomes evidence for broader CareFi infrastructure: reference markets, risk surfaces, listed products, and structured exposure.",5000000,0.50,1.02,1.10,1500000,1650000,150000000,30,0.35,50000000,0.08,7500000,12,12000000,1500000
